{"schemaVersion":"1.0.0","toolVersion":"0.1.0-rc.1","ruleSetVersion":"1.0.0","root":".","filesInspected":1,"status":"incomplete","triage":"incomplete","summary":{"findings":1,"unknowns":1,"diagnostics":0,"highestSeverity":"medium","bySeverity":{"info":0,"low":0,"medium":1,"high":0},"byMappingKind":{"direct":0,"conditional":0,"indexer-required":0,"no-direct-rpc-equivalent":0,"unknown":1},"manualReviewRequired":2},"findings":[{"id":"c821e0f5a6c6ea7e5ffe065f4d44589e","ruleId":"horizon.unmapped-pattern","ruleVersion":"1.0.0","detectionKind":"sdk-client","detectorPattern":"sdk.Horizon.Server","location":{"file":"utils/env_config.ts","start":{"line":88,"column":11},"end":{"line":88,"column":25}},"mappingKind":"unknown","severity":"medium","confidence":"unknown","reasonCodes":["UNMAPPED_HORIZON_PATTERN","APPLICATION_REVIEW_REQUIRED"],"recommendedAction":"Review this detected Horizon dependency manually. No reviewed migration rule covers its normalized detector pattern.","rpcMethods":[],"officialSources":[{"url":"https://developers.stellar.org/docs/data/apis/migrate-from-horizon-to-rpc","checkedDate":"2026-10-09","note":"Official endpoint-mapping table and classic event warning; page last updated 2026-08-18."},{"url":"https://developers.stellar.org/docs/data/apis/rpc","checkedDate":"2026-10-09","note":"RPC is not a Horizon drop-in or historical indexer; recent history window is provider-dependent."}],"limitations":["Do not replace the SDK/HTTP call automatically; review filters, paging, response shape and provider capabilities.","Horizon REST/HAL and RPC JSON-RPC response schemas differ; investigate data shape and application behavior."]}],"unknowns":[{"code":"DYNAMIC_HORIZON_URL","location":{"file":"utils/env_config.ts","start":{"line":88,"column":26},"end":{"line":88,"column":41}},"message":"Horizon client URL cannot be determined statically."}],"diagnostics":[]}
