{"schemaVersion":"1.0.0","toolVersion":"0.1.0-rc.1","ruleSetVersion":"1.0.0","root":".","filesInspected":1,"status":"incomplete","triage":"incomplete","summary":{"findings":1,"unknowns":1,"diagnostics":0,"highestSeverity":"high","bySeverity":{"info":0,"low":0,"medium":0,"high":1},"byMappingKind":{"direct":0,"conditional":0,"indexer-required":1,"no-direct-rpc-equivalent":0,"unknown":0},"manualReviewRequired":2},"findings":[{"id":"b15cfbbd9a59fb271c86c63486a6ada8","ruleId":"horizon.http.account-list","ruleVersion":"1.0.0","detectionKind":"http-call","detectorPattern":"http.GET./accounts","location":{"file":"src/café-🚀.ts","start":{"line":1,"column":1},"end":{"line":1,"column":6}},"mappingKind":"indexer-required","severity":"high","confidence":"high","reasonCodes":["INDEXER_REQUIRED","RPC_HISTORY_LIMIT","APPLICATION_REVIEW_REQUIRED"],"recommendedAction":"Build or use a historical account index; the RPC API has no direct account-list equivalent.","rpcMethods":[],"officialSources":[{"url":"https://developers.stellar.org/docs/data/apis/migrate-from-horizon-to-rpc","checkedDate":"2026-10-09","note":"Official endpoint-mapping table and classic event warning; page last updated 2026-08-18."},{"url":"https://developers.stellar.org/docs/data/apis/rpc","checkedDate":"2026-10-09","note":"RPC is not a Horizon drop-in or historical indexer; recent history window is provider-dependent."}],"limitations":["RPC retains only a bounded recent history window (around seven days by default, provider-dependent).","RPC does not maintain Horizon account-list indexes."]}],"unknowns":[{"code":"DYNAMIC_HTTP_URL","location":{"file":"src/café-🚀.ts","start":{"line":2,"column":7},"end":{"line":2,"column":47}},"message":"Possible Horizon request address cannot be determined statically."}],"diagnostics":[]}
