{"schemaVersion":"1.0.0","toolVersion":"0.0.0","ruleSetVersion":"1.0.0","root":".","filesInspected":1,"status":"complete","triage":"no-supported-evidence","summary":{"findings":0,"unknowns":0,"diagnostics":0,"highestSeverity":null,"bySeverity":{"info":0,"low":0,"medium":0,"high":0},"byMappingKind":{"direct":0,"conditional":0,"indexer-required":0,"no-direct-rpc-equivalent":0,"unknown":0},"manualReviewRequired":0},"findings":[],"unknowns":[],"diagnostics":[]}
