{"schemaVersion":"1.0.0","toolVersion":"0.0.0","ruleSetVersion":"1.0.0","root":".","filesInspected":1,"status":"complete","triage":"review-required","summary":{"findings":3,"unknowns":0,"diagnostics":0,"highestSeverity":"high","bySeverity":{"info":0,"low":0,"medium":2,"high":1},"byMappingKind":{"direct":0,"conditional":0,"indexer-required":1,"no-direct-rpc-equivalent":0,"unknown":2},"manualReviewRequired":3},"findings":[{"id":"ec0d1745140b06a2f89f7c49c2e2fa2d","ruleId":"horizon.http.account-list","ruleVersion":"1.0.0","detectionKind":"http-call","detectorPattern":"http.GET./accounts","location":{"file":"src/café-🚀.ts","start":{"line":4,"column":1},"end":{"line":4,"column":6}},"mappingKind":"indexer-required","severity":"high","confidence":"high","reasonCodes":["INDEXER_REQUIRED","RPC_HISTORY_LIMIT","APPLICATION_REVIEW_REQUIRED"],"recommendedAction":"Build or use a historical account index; the RPC API has no direct account-list equivalent.","rpcMethods":[],"officialSources":[{"url":"https://developers.stellar.org/docs/data/apis/migrate-from-horizon-to-rpc","checkedDate":"2026-10-09","note":"Official endpoint-mapping table and classic event warning; page last updated 2026-08-18."},{"url":"https://developers.stellar.org/docs/data/apis/rpc","checkedDate":"2026-10-09","note":"RPC is not a Horizon drop-in or historical indexer; recent history window is provider-dependent."}],"limitations":["RPC retains only a bounded recent history window (around seven days by default, provider-dependent).","RPC does not maintain Horizon account-list indexes."]},{"id":"672c371559783f296f59b68fb01ecb43","ruleId":"horizon.unmapped-pattern","ruleVersion":"1.0.0","detectionKind":"sdk-client","detectorPattern":"sdk.Horizon.Server","location":{"file":"src/café-🚀.ts","start":{"line":2,"column":20},"end":{"line":2,"column":34}},"mappingKind":"unknown","severity":"medium","confidence":"unknown","reasonCodes":["UNMAPPED_HORIZON_PATTERN","APPLICATION_REVIEW_REQUIRED"],"recommendedAction":"Review this detected Horizon dependency manually. No reviewed migration rule covers its normalized detector pattern.","rpcMethods":[],"officialSources":[{"url":"https://developers.stellar.org/docs/data/apis/migrate-from-horizon-to-rpc","checkedDate":"2026-10-09","note":"Official endpoint-mapping table and classic event warning; page last updated 2026-08-18."},{"url":"https://developers.stellar.org/docs/data/apis/rpc","checkedDate":"2026-10-09","note":"RPC is not a Horizon drop-in or historical indexer; recent history window is provider-dependent."}],"limitations":["Do not replace the SDK/HTTP call automatically; review filters, paging, response shape and provider capabilities.","Horizon REST/HAL and RPC JSON-RPC response schemas differ; investigate data shape and application behavior."]},{"id":"ea2bc2a056becbfcaa3b9b06b2490a88","ruleId":"horizon.sdk.account-query","ruleVersion":"1.0.0","detectionKind":"sdk-call","detectorPattern":"sdk.Horizon.Server.accounts","location":{"file":"src/café-🚀.ts","start":{"line":3,"column":1},"end":{"line":3,"column":16}},"mappingKind":"unknown","severity":"medium","confidence":"unknown","reasonCodes":["UNMAPPED_HORIZON_PATTERN","APPLICATION_REVIEW_REQUIRED"],"recommendedAction":"Inspect subsequent account filters or call builders before choosing account lookup versus list/indexing migration.","rpcMethods":[],"officialSources":[{"url":"https://developers.stellar.org/docs/data/apis/migrate-from-horizon-to-rpc","checkedDate":"2026-10-09","note":"Official endpoint-mapping table and classic event warning; page last updated 2026-08-18."},{"url":"https://developers.stellar.org/docs/data/apis/rpc","checkedDate":"2026-10-09","note":"RPC is not a Horizon drop-in or historical indexer; recent history window is provider-dependent."}],"limitations":["Do not replace the SDK/HTTP call automatically; review filters, paging, response shape and provider capabilities.","The detected SDK builder method does not reveal a final requested endpoint."]}],"unknowns":[],"diagnostics":[]}
