{"schemaVersion":"1.0.0","toolVersion":"0.1.0-rc.1","ruleSetVersion":"1.0.0","root":".","filesInspected":13,"status":"incomplete","triage":"incomplete","summary":{"findings":0,"unknowns":1,"diagnostics":0,"highestSeverity":null,"bySeverity":{"info":0,"low":0,"medium":0,"high":0},"byMappingKind":{"direct":0,"conditional":0,"indexer-required":0,"no-direct-rpc-equivalent":0,"unknown":0},"manualReviewRequired":1},"findings":[],"unknowns":[{"code":"LEGACY_SDK_SERVER","location":{"file":"app/stellar/index.js","start":{"line":3,"column":20},"end":{"line":3,"column":37}},"message":"Legacy Stellar SDK Server requires manual Horizon dependency assessment."}],"diagnostics":[]}
